{
  "$schema": "urn:fortress:derived:v3:local-quality-certificate",
  "schema_version": 3,
  "semantic_version": "quality-certificate-v3.0",
  "project": "PF-FORTRESS",
  "profile": "fortress-complete-local-v1",
  "claim": "LOCAL_QUALITY_GATES_PASS",
  "trust": {
    "level": "untrusted-local",
    "tamper_evidence": "SHA-256",
    "authenticity": "UNVERIFIED",
    "limitation": "Digest stamps detect mutation and staleness but are not signatures; authenticated antiforgery requires an external trusted signing identity."
  },
  "source": {
    "fingerprint": "sha256:b78240bcb4e4130117ca181cd59f6dd6bf5654b0b8b8bd7ca41b65b1d2710e3d",
    "file_count": 485,
    "excluded_self": "quality-certificate",
    "excluded_derived_artifacts": [
      "bfg",
      "ccg",
      "certification",
      "environmental",
      "evidence-graph",
      "information-flow",
      "psm",
      "realized-bfg",
      "references",
      "semantic",
      "semantic-conformance",
      "source-artifacts",
      "state-effect",
      "verified-bfg"
    ]
  },
  "toolchain": {
    "rust": "1.97.1",
    "cargo_config": "_data/cargo_config.toml",
    "resolver_lockfile": "_info/Cargo.lock",
    "build_artifacts": "external-temporary-directory",
    "derived_projections": "external-subject-addressed-cache"
  },
  "gates": [
    {
      "id": "ARTIFACT_BFG",
      "status": "PASS",
      "command": "fortress certify . --format json --evidence-output <machine-local-path> --certification-output <machine-local-path> --verified-bfg-output <machine-local-path> --projection-output-dir <machine-local-path> --audit-output <machine-local-path>"
    },
    {
      "id": "ARTIFACT_CCG",
      "status": "PASS",
      "command": "fortress certify . --format json --evidence-output <machine-local-path> --certification-output <machine-local-path> --verified-bfg-output <machine-local-path> --projection-output-dir <machine-local-path> --audit-output <machine-local-path>"
    },
    {
      "id": "ARTIFACT_CERTIFICATION",
      "status": "PASS",
      "command": "fortress certify . --format json --evidence-output <machine-local-path> --certification-output <machine-local-path> --verified-bfg-output <machine-local-path> --projection-output-dir <machine-local-path> --audit-output <machine-local-path>"
    },
    {
      "id": "ARTIFACT_ENVIRONMENTAL",
      "status": "PASS",
      "command": "fortress certify . --format json --evidence-output <machine-local-path> --certification-output <machine-local-path> --verified-bfg-output <machine-local-path> --projection-output-dir <machine-local-path> --audit-output <machine-local-path>"
    },
    {
      "id": "ARTIFACT_EVIDENCE_GRAPH",
      "status": "PASS",
      "command": "fortress certify . --format json --evidence-output <machine-local-path> --certification-output <machine-local-path> --verified-bfg-output <machine-local-path> --projection-output-dir <machine-local-path> --audit-output <machine-local-path>"
    },
    {
      "id": "ARTIFACT_INFORMATION_FLOW",
      "status": "PASS",
      "command": "fortress certify . --format json --evidence-output <machine-local-path> --certification-output <machine-local-path> --verified-bfg-output <machine-local-path> --projection-output-dir <machine-local-path> --audit-output <machine-local-path>"
    },
    {
      "id": "ARTIFACT_PSM",
      "status": "PASS",
      "command": "fortress certify . --format json --evidence-output <machine-local-path> --certification-output <machine-local-path> --verified-bfg-output <machine-local-path> --projection-output-dir <machine-local-path> --audit-output <machine-local-path>"
    },
    {
      "id": "ARTIFACT_REALIZED_BFG",
      "status": "PASS",
      "command": "fortress certify . --format json --evidence-output <machine-local-path> --certification-output <machine-local-path> --verified-bfg-output <machine-local-path> --projection-output-dir <machine-local-path> --audit-output <machine-local-path>"
    },
    {
      "id": "ARTIFACT_REFERENCES",
      "status": "PASS",
      "command": "fortress certify . --format json --evidence-output <machine-local-path> --certification-output <machine-local-path> --verified-bfg-output <machine-local-path> --projection-output-dir <machine-local-path> --audit-output <machine-local-path>"
    },
    {
      "id": "ARTIFACT_SEMANTIC",
      "status": "PASS",
      "command": "fortress certify . --format json --evidence-output <machine-local-path> --certification-output <machine-local-path> --verified-bfg-output <machine-local-path> --projection-output-dir <machine-local-path> --audit-output <machine-local-path>"
    },
    {
      "id": "ARTIFACT_SEMANTIC_CONFORMANCE",
      "status": "PASS",
      "command": "fortress certify . --format json --evidence-output <machine-local-path> --certification-output <machine-local-path> --verified-bfg-output <machine-local-path> --projection-output-dir <machine-local-path> --audit-output <machine-local-path>"
    },
    {
      "id": "ARTIFACT_SOURCE_ARTIFACTS",
      "status": "PASS",
      "command": "fortress certify . --format json --evidence-output <machine-local-path> --certification-output <machine-local-path> --verified-bfg-output <machine-local-path> --projection-output-dir <machine-local-path> --audit-output <machine-local-path>"
    },
    {
      "id": "ARTIFACT_STATE_EFFECT",
      "status": "PASS",
      "command": "fortress certify . --format json --evidence-output <machine-local-path> --certification-output <machine-local-path> --verified-bfg-output <machine-local-path> --projection-output-dir <machine-local-path> --audit-output <machine-local-path>"
    },
    {
      "id": "ARTIFACT_VERIFIED_BFG",
      "status": "PASS",
      "command": "fortress certify . --format json --evidence-output <machine-local-path> --certification-output <machine-local-path> --verified-bfg-output <machine-local-path> --projection-output-dir <machine-local-path> --audit-output <machine-local-path>"
    },
    {
      "id": "AUDIT_JSON_DETERMINISM",
      "status": "PASS",
      "command": "fortress certify . --format json --evidence-output <machine-local-path> --certification-output <machine-local-path> --verified-bfg-output <machine-local-path> --projection-output-dir <machine-local-path> --audit-output <machine-local-path>"
    },
    {
      "id": "CLIPPY",
      "status": "PASS",
      "command": "cargo +1.97.1 --config _data/cargo_config.toml clippy --manifest-path _data/Cargo.toml --workspace --all-targets --all-features -- -D warnings"
    },
    {
      "id": "DERIVED_ARTIFACT_STORAGE",
      "status": "PASS",
      "command": "python engine/snapshot_governance/testing/_code/derived_artifact_storage.py"
    },
    {
      "id": "EXECUTION_STORAGE",
      "status": "PASS",
      "command": "python engine/snapshot_governance/testing/_code/execution_storage.py"
    },
    {
      "id": "FORMAT",
      "status": "PASS",
      "command": "cargo +1.97.1 --config _data/cargo_config.toml fmt --manifest-path _data/Cargo.toml --all --check"
    },
    {
      "id": "FULL_PROFILE_CERTIFICATION",
      "status": "PASS",
      "command": "fortress certify . --format json --evidence-output <machine-local-path> --certification-output <machine-local-path> --verified-bfg-output <machine-local-path> --projection-output-dir <machine-local-path> --audit-output <machine-local-path>"
    },
    {
      "id": "PROJECT_FILING_SYSTEM",
      "status": "PASS",
      "command": "cargo +1.97.1 --config _data/cargo_config.toml test --manifest-path _data/Cargo.toml --all-features --test filing_system --test repo_module_001 --test repo_docs_001"
    },
    {
      "id": "RUSTDOC",
      "status": "PASS",
      "command": "cargo +1.97.1 --config _data/cargo_config.toml doc --manifest-path _data/Cargo.toml --workspace --all-features --no-deps"
    },
    {
      "id": "SCHEMA_AND_STANDARD",
      "status": "PASS",
      "command": "cargo +1.97.1 --config _data/cargo_config.toml test --manifest-path _data/Cargo.toml --all-features --test schema_registry"
    },
    {
      "id": "SCHEMA_ARTIFACTS",
      "status": "PASS",
      "command": "cargo +1.97.1 --config _data/cargo_config.toml test --manifest-path _data/Cargo.toml --all-features --test artifact_schemas"
    },
    {
      "id": "SELF_AUDIT",
      "status": "PASS",
      "command": "fortress certify . --format json --evidence-output <machine-local-path> --certification-output <machine-local-path> --verified-bfg-output <machine-local-path> --projection-output-dir <machine-local-path> --audit-output <machine-local-path>"
    },
    {
      "id": "SELF_MODEL",
      "status": "PASS",
      "command": "cargo +1.97.1 --config _data/cargo_config.toml test --manifest-path _data/Cargo.toml --all-features --test self_model"
    },
    {
      "id": "SOURCE_ARCHITECTURE",
      "status": "PASS",
      "command": "cargo +1.97.1 --config _data/cargo_config.toml test --manifest-path _data/Cargo.toml --all-features --test source_architecture"
    },
    {
      "id": "WORKSPACE_TESTS",
      "status": "PASS",
      "command": "fortress certify . --format json --evidence-output <machine-local-path> --certification-output <machine-local-path> --verified-bfg-output <machine-local-path> --projection-output-dir <machine-local-path> --audit-output <machine-local-path>"
    }
  ],
  "artifacts": [
    {
      "id": "bfg",
      "digest": "sha256:52e3b1ede1dc729096bd4ab98351b69b79aee84f934f36654ca2c7b6ec04cc38",
      "bytes": 136963,
      "storage": "TRACKED_EVIDENCE"
    },
    {
      "id": "ccg",
      "digest": "sha256:926494f4045758cac2d9481cb46dcabaaa014be3c56400ca579a77b1534dd6c8",
      "bytes": 2799888,
      "storage": "LOCAL_MATERIALIZATION"
    },
    {
      "id": "certification",
      "digest": "sha256:f965c02d19d72bcae7cba48abcce9cca8d64132ec39712428e585a872e6c3a98",
      "bytes": 109305,
      "storage": "TRACKED_EVIDENCE"
    },
    {
      "id": "environmental",